{
  "$schema": "http://json-schema.org/draft-07/schema#",
  "$id": "https://github.com/software-description-language/spec/data-shape.schema.json",
  "title": "SDL DataShape",
  "description": "A DataShape describes the structure, constraints, and meaning of data that flows through the service — request payloads, response bodies, domain entities, events, and value objects. DataShapes are the DL Shape concept in SDL. They are NOT a replacement for JSON Schema, Protobuf, or Zod — they are a plain-language description layer that references those formal contracts. DataShapes let engineers understand what data means without reading the formal schema.",
  "type": "object",
  "dl": {
    "profile": "software",
    "version": "0.1",
    "concepts": ["Shape"],
    "layer": "schema",
    "notes": "DataShape describes the data that flows into/out of Operations (Units) and along Connects. It references formal schemas but does not replace them."
  },
  "required": ["id", "label", "kind", "fields"],
  "additionalProperties": false,
  "properties": {
    "id": {
      "type": "string",
      "description": "Unique kebab-case identifier for this data shape within the service.",
      "pattern": "^[a-z0-9][a-z0-9-_]*[a-z0-9]$",
      "examples": ["create-order-request", "order-record", "payment-completed-event"]
    },
    "label": {
      "type": "string",
      "description": "Human-readable name for this data shape.",
      "examples": ["Create Order Request", "Order Record", "Payment Completed Event"]
    },
    "description": {
      "type": "string",
      "description": "What this data shape represents and where it appears in the service."
    },
    "kind": {
      "type": "string",
      "description": "The role this data shape plays in the service lifecycle.",
      "enum": [
        "request",
        "response",
        "domain-entity",
        "event",
        "command",
        "value-object",
        "error",
        "internal",
        "custom"
      ]
    },
    "schema_ref": {
      "type": "object",
      "description": "Optional reference to a formal schema that defines this shape precisely. SDL describes it; the contract file defines it.",
      "required": ["type", "ref"],
      "properties": {
        "type": {
          "type": "string",
          "enum": ["json-schema", "zod", "protobuf", "avro", "typescript", "graphql", "custom"]
        },
        "ref": {
          "type": "string",
          "description": "Path or URI to the formal schema. For protobuf, may include the message name after '#'.",
          "examples": [
            "./src/schemas/order.schema.ts",
            "./contracts/order.proto#CreateOrderRequest",
            "./contracts/order-service.openapi.yaml#/components/schemas/CreateOrderRequest"
          ]
        }
      },
      "additionalProperties": false
    },
    "fields": {
      "type": "array",
      "description": "The fields in this data shape. Write in plain language — not code syntax. Include what each field means and any important business-level constraints.",
      "minItems": 1,
      "items": {
        "type": "object",
        "required": ["name", "type"],
        "additionalProperties": false,
        "properties": {
          "name": {
            "type": "string",
            "description": "Field name as it appears in the data.",
            "examples": ["orderId", "lineItems", "shippingAddress", "total"]
          },
          "type": {
            "type": "string",
            "description": "The data type. Use primitives (string, number, boolean, uuid, timestamp), a reference to another DataShape id, or array notation ([]).",
            "examples": ["string", "number", "boolean", "uuid", "timestamp", "OrderLineItem[]", "ShippingAddress"]
          },
          "required": {
            "type": "boolean",
            "description": "Whether this field must be present.",
            "default": true
          },
          "description": {
            "type": "string",
            "description": "What this field means in business terms. Not a technical description — explain the domain significance."
          },
          "constraints": {
            "type": "array",
            "description": "Business-level constraints on this field. Write in plain language, not regex or schema syntax.",
            "items": { "type": "string" },
            "examples": [["Must be a positive integer", "Maximum 50 items per order", "ISO 8601 format required"]]
          },
          "pii": {
            "type": "boolean",
            "description": "Whether this field contains personally identifiable information. Affects logging, storage, and compliance requirements.",
            "default": false
          },
          "sensitive": {
            "type": "boolean",
            "description": "Whether this field is sensitive but not strictly PII (e.g., payment amounts, internal IDs, pricing).",
            "default": false
          }
        }
      }
    },
    "tags": {
      "type": "array",
      "items": { "type": "string" },
      "examples": [["pii", "validated", "persisted", "event-payload"]]
    },
    "meta": {
      "type": "object",
      "additionalProperties": true
    }
  }
}
