[
  {
    "id": "create-order-request",
    "label": "Create Order Request",
    "description": "The request payload submitted by a customer to place an order. Arrives at POST /orders after JWT authentication and schema validation.",
    "kind": "request",
    "schema_ref": {
      "type": "zod",
      "ref": "src/schemas/order.schema.ts#CreateOrderRequestSchema"
    },
    "fields": [
      {
        "name": "lineItems",
        "type": "OrderLineItem[]",
        "required": true,
        "description": "The items the customer wants to purchase.",
        "constraints": ["Must contain at least one item", "Maximum 50 items per order", "Each item must have a positive quantity"]
      },
      {
        "name": "shippingAddress",
        "type": "ShippingAddress",
        "required": true,
        "description": "The delivery address for the order.",
        "constraints": ["Must be a supported delivery region"]
      },
      {
        "name": "idempotencyKey",
        "type": "uuid",
        "required": false,
        "description": "Optional client-supplied idempotency key. If provided, the server may use it for deduplication at the API gateway layer."
      }
    ],
    "tags": ["validated", "user-facing"]
  },
  {
    "id": "create-order-response",
    "label": "Create Order Response",
    "description": "The response returned to the customer after a successful order creation. Contains the order ID and the Stripe client_secret needed to complete payment on the client side.",
    "kind": "response",
    "fields": [
      {
        "name": "orderId",
        "type": "uuid",
        "required": true,
        "description": "The unique identifier for the newly created order."
      },
      {
        "name": "status",
        "type": "string",
        "required": true,
        "description": "The initial order status. Always 'AWAITING_PAYMENT' on creation.",
        "constraints": ["Always 'AWAITING_PAYMENT' at this point"]
      },
      {
        "name": "clientSecret",
        "type": "string",
        "required": true,
        "description": "Stripe PaymentIntent client_secret. The customer uses this to confirm payment on the client side via Stripe.js.",
        "sensitive": true
      },
      {
        "name": "reviewFlag",
        "type": "boolean",
        "required": false,
        "description": "Present and true when the order has been flagged for manual review due to a high total value (> $10,000). Informs the customer that their order will require additional review before confirmation."
      }
    ],
    "tags": ["user-facing"]
  },
  {
    "id": "order-record",
    "label": "Order Record",
    "description": "The persisted order entity in the database. The source of truth for order state.",
    "kind": "domain-entity",
    "schema_ref": {
      "type": "typescript",
      "ref": "src/entities/order.entity.ts#OrderEntity"
    },
    "fields": [
      {
        "name": "orderId",
        "type": "uuid",
        "required": true,
        "description": "Primary key. Unique identifier for the order."
      },
      {
        "name": "userId",
        "type": "uuid",
        "required": true,
        "description": "The authenticated user who placed the order.",
        "pii": true
      },
      {
        "name": "status",
        "type": "string",
        "required": true,
        "description": "Current state in the order state machine.",
        "constraints": ["Enum: AWAITING_PAYMENT | CONFIRMED | PENDING_REVIEW | PAYMENT_FAILED | SHIPPED | DELIVERED | CANCELLED"]
      },
      {
        "name": "lineItems",
        "type": "OrderLineItem[]",
        "required": true,
        "description": "Snapshot of the items at the time of order creation. Immutable after creation.",
        "constraints": ["Stored as JSONB. Not updated after order creation — reflects what was ordered, not current inventory."]
      },
      {
        "name": "total",
        "type": "number",
        "required": true,
        "description": "Total order value in the smallest currency unit (cents). Computed at creation time from lineItems.",
        "sensitive": true
      },
      {
        "name": "paymentIntentId",
        "type": "string",
        "required": true,
        "description": "Stripe PaymentIntent ID associated with this order. Used to reconcile payment events.",
        "sensitive": true
      },
      {
        "name": "reviewFlag",
        "type": "boolean",
        "required": true,
        "description": "True when the order total exceeds $10,000. Causes the order to require manual review before auto-confirmation.",
        "constraints": ["Set at creation time. Immutable."]
      },
      {
        "name": "shippingAddress",
        "type": "ShippingAddress",
        "required": true,
        "description": "Delivery address snapshot.",
        "pii": true
      },
      {
        "name": "createdAt",
        "type": "timestamp",
        "required": true,
        "description": "UTC timestamp of order creation."
      },
      {
        "name": "updatedAt",
        "type": "timestamp",
        "required": true,
        "description": "UTC timestamp of last status update."
      }
    ],
    "tags": ["persisted", "pii", "sensitive"]
  },
  {
    "id": "payment-completed-event",
    "label": "Payment Completed Event",
    "description": "Kafka event published by the Payment Service when a Stripe payment is successfully confirmed. Consumed by the Order Service to transition the order to CONFIRMED.",
    "kind": "event",
    "schema_ref": {
      "type": "avro",
      "ref": "./contracts/payment-completed.avsc"
    },
    "fields": [
      {
        "name": "eventId",
        "type": "uuid",
        "required": true,
        "description": "Unique event identifier. Used for deduplication."
      },
      {
        "name": "orderId",
        "type": "uuid",
        "required": true,
        "description": "The order this payment confirmation belongs to."
      },
      {
        "name": "paymentIntentId",
        "type": "string",
        "required": true,
        "description": "The Stripe PaymentIntent ID that was confirmed. Must match the paymentIntentId stored on the order.",
        "sensitive": true
      },
      {
        "name": "amount",
        "type": "number",
        "required": true,
        "description": "Amount confirmed in smallest currency unit (cents).",
        "sensitive": true
      },
      {
        "name": "confirmedAt",
        "type": "timestamp",
        "required": true,
        "description": "UTC timestamp of when Stripe confirmed the payment."
      }
    ],
    "tags": ["event-payload", "sensitive"]
  },
  {
    "id": "payment-failed-event",
    "label": "Payment Failed Event",
    "description": "Kafka event published by the Payment Service when a Stripe payment fails. Consumed by the Order Service to transition the order to PAYMENT_FAILED.",
    "kind": "event",
    "fields": [
      {
        "name": "eventId",
        "type": "uuid",
        "required": true,
        "description": "Unique event identifier. Used for deduplication."
      },
      {
        "name": "orderId",
        "type": "uuid",
        "required": true,
        "description": "The order this failure belongs to."
      },
      {
        "name": "paymentIntentId",
        "type": "string",
        "required": true,
        "description": "The Stripe PaymentIntent ID that failed.",
        "sensitive": true
      },
      {
        "name": "failureReason",
        "type": "string",
        "required": true,
        "description": "Human-readable reason for payment failure from Stripe.",
        "constraints": ["Examples: 'card_declined', 'insufficient_funds', 'expired_card'"]
      },
      {
        "name": "failedAt",
        "type": "timestamp",
        "required": true,
        "description": "UTC timestamp of when the payment failure was recorded."
      }
    ],
    "tags": ["event-payload"]
  },
  {
    "id": "order-line-item",
    "label": "Order Line Item",
    "description": "A single product and quantity within an order. Used both in the request payload and stored as a snapshot in the order record.",
    "kind": "value-object",
    "fields": [
      {
        "name": "productId",
        "type": "uuid",
        "required": true,
        "description": "Identifier of the product being ordered."
      },
      {
        "name": "quantity",
        "type": "number",
        "required": true,
        "description": "Number of units of this product.",
        "constraints": ["Must be a positive integer (minimum 1)"]
      },
      {
        "name": "unitPrice",
        "type": "number",
        "required": true,
        "description": "Price per unit in smallest currency unit (cents) at the time of order creation. Snapshotted to prevent price changes from affecting historical orders.",
        "sensitive": true
      },
      {
        "name": "productName",
        "type": "string",
        "required": true,
        "description": "Snapshotted product name at the time of order. Prevents order history from breaking if a product is renamed."
      }
    ],
    "tags": ["value-object", "sensitive"]
  }
]
